,Lake,Stocked Fish,Dates,latitude,longitude,Directions
0,BUMPING Lake Yakima County Washington,"3,000","Jun 1, 2022",46.848999,-121.3277593,https://www.google.com/maps/search/?api=1&query=BUMPING Lake Yakima County Washington
1,INDIAN FLAT Pond Yakima County Washington,"1,080","Jun 1, 2022",46.9809499,-121.1420287,https://www.google.com/maps/search/?api=1&query=INDIAN FLAT Pond Yakima County Washington
2,ORTING SOLDIERS HM Pierce County Washington,250,"Jun 1, 2022",47.0978795,-122.2042824,https://www.google.com/maps/search/?api=1&query=ORTING SOLDIERS HM Pierce County Washington
3,QUARTZ C PONDNACHESYakima County Washington,600,"Jun 1, 2022",46.730958,-120.699516,https://www.google.com/maps/search/?api=1&query=QUARTZ C PONDNACHESYakima County Washington
4,SARGE HUBBARD Pond Yakima County Washington,"1,008","Jun 1, 2022",46.6015053,-120.4748382,https://www.google.com/maps/search/?api=1&query=SARGE HUBBARD Pond Yakima County Washington
5,SARGE HUBBARD Pond Yakima County Washington,200,"Jun 1, 2022",46.6015053,-120.4748382,https://www.google.com/maps/search/?api=1&query=SARGE HUBBARD Pond Yakima County Washington
6,TIMS Pond Yakima County Washington,"1,320","Jun 1, 2022",46.7318642,-120.7967565,https://www.google.com/maps/search/?api=1&query=TIMS Pond Yakima County Washington
7,WAPATO Lake Pierce County Washington,"2,000","Jun 1, 2022",47.19481,-122.4565584,https://www.google.com/maps/search/?api=1&query=WAPATO Lake Pierce County Washington
8,BLACK Lake Pacific County Washington,"1,596","May 31, 2022",46.3160225,-124.0422092,https://www.google.com/maps/search/?api=1&query=BLACK Lake Pacific County Washington
9,SNAG Lake Pacific County Washington,504,"May 31, 2022",46.4194831,-123.8147843,https://www.google.com/maps/search/?api=1&query=SNAG Lake Pacific County Washington
10,WESTERN Lake Pacific County Washington,504,"May 31, 2022",46.4235019,-123.8203929,https://www.google.com/maps/search/?api=1&query=WESTERN Lake Pacific County Washington
11,BLACK Lake Pacific County Washington,"2,810","May 27, 2022",46.3160225,-124.0422092,https://www.google.com/maps/search/?api=1&query=BLACK Lake Pacific County Washington
12,CARNEY Lake Pierce County Washington,684,"May 27, 2022",47.4029761,-122.7610455,https://www.google.com/maps/search/?api=1&query=CARNEY Lake Pierce County Washington
13,FAILOR Lake Grays Harbor County Washington,100,"May 27, 2022",47.108716,-123.9584045,https://www.google.com/maps/search/?api=1&query=FAILOR Lake Grays Harbor County Washington
14,Lake ABERDEEN Grays Harbor County Washington,300,"May 27, 2022",46.9834021,-123.7422743,https://www.google.com/maps/search/?api=1&query=Lake ABERDEEN Grays Harbor County Washington
15,SNAG Lake Pacific County Washington,950,"May 27, 2022",46.4194831,-123.8147843,https://www.google.com/maps/search/?api=1&query=SNAG Lake Pacific County Washington
16,SYLVIA Lake Grays Harbor County Washington,250,"May 27, 2022",46.9977042,-123.5922925,https://www.google.com/maps/search/?api=1&query=SYLVIA Lake Grays Harbor County Washington
17,UNION FLAT Creek Whitman County Washington,500,"May 27, 2022",46.82787393910623,-117.9924818156095,https://www.google.com/maps/search/?api=1&query=UNION FLAT Creek Whitman County Washington
18,VANCE Creek ADLT Pond Grays Harbor County Washington,250,"May 27, 2022",47.00507560301562,-123.4233594994362,https://www.google.com/maps/search/?api=1&query=VANCE Creek ADLT Pond Grays Harbor County Washington
19,VANCE Creek JV Pond Grays Harbor County Washington,200,"May 27, 2022",47.00507560301562,-123.4233594994362,https://www.google.com/maps/search/?api=1&query=VANCE Creek JV Pond Grays Harbor County Washington
20,WATSON Lake Columbia County Washington,750,"May 27, 2022",46.2848889,-117.6549763,https://www.google.com/maps/search/?api=1&query=WATSON Lake Columbia County Washington
21,WESTERN Lake Pacific County Washington,950,"May 27, 2022",46.4235019,-123.8203929,https://www.google.com/maps/search/?api=1&query=WESTERN Lake Pacific County Washington
22,BENNINGTON Lake Walla Walla County Washington,"1,138","May 26, 2022",46.0651146,-118.260109,https://www.google.com/maps/search/?api=1&query=BENNINGTON Lake Walla Walla County Washington
23,BLUE Lake Columbia County Washington,"1,463","May 26, 2022",46.2775138,-117.814262,https://www.google.com/maps/search/?api=1&query=BLUE Lake Columbia County Washington
24,CURL Lake Columbia County Washington,"5,100","May 26, 2022",46.2545636,-117.672004,https://www.google.com/maps/search/?api=1&query=CURL Lake Columbia County Washington
25,CURL Lake Columbia County Washington,305,"May 26, 2022",46.2545636,-117.672004,https://www.google.com/maps/search/?api=1&query=CURL Lake Columbia County Washington
26,FRANKS POND Chelan County Washington,500,"May 26, 2022",47.9445331,-120.6749068,https://www.google.com/maps/search/?api=1&query=FRANKS POND Chelan County Washington
27,FRANKS POND Chelan County Washington,50,"May 26, 2022",47.9445331,-120.6749068,https://www.google.com/maps/search/?api=1&query=FRANKS POND Chelan County Washington
28,LEWIS County Park PDS Lewis County Washington,"1,840","May 26, 2022",46.6195461,-122.4554639,https://www.google.com/maps/search/?api=1&query=LEWIS County Park PDS Lewis County Washington
29,Lake ABERDEEN Grays Harbor County Washington,"1,250","May 26, 2022",46.9834021,-123.7422743,https://www.google.com/maps/search/?api=1&query=Lake ABERDEEN Grays Harbor County Washington
30,Lake KOKANEE Mason County Washington,"3,036","May 26, 2022",47.40212760000001,-123.2045661,https://www.google.com/maps/search/?api=1&query=Lake KOKANEE Mason County Washington
31,LONGS Pond Thurston County Washington,"1,098","May 26, 2022",47.0393267,-122.7911503,https://www.google.com/maps/search/?api=1&query=LONGS Pond Thurston County Washington
32,LONGS Pond Thurston County Washington,300,"May 26, 2022",47.0393267,-122.7911503,https://www.google.com/maps/search/?api=1&query=LONGS Pond Thurston County Washington
33,RAINBOW Lake Columbia County Washington,"2,400","May 26, 2022",46.2775138,-117.814262,https://www.google.com/maps/search/?api=1&query=RAINBOW Lake Columbia County Washington
34,SPRING Creek Klickitat County Washington,500,"May 26, 2022",45.8536429,-120.9295196,https://www.google.com/maps/search/?api=1&query=SPRING Creek Klickitat County Washington
35,SPRING Creek Klickitat County Washington,"2,500","May 26, 2022",45.8536429,-120.9295196,https://www.google.com/maps/search/?api=1&query=SPRING Creek Klickitat County Washington
36,SWOFFORD Pond Lewis County Washington,"4,600","May 26, 2022",46.4975041,-122.4044042,https://www.google.com/maps/search/?api=1&query=SWOFFORD Pond Lewis County Washington
37,SYLVIA Lake Grays Harbor County Washington,500,"May 26, 2022",46.9977042,-123.5922925,https://www.google.com/maps/search/?api=1&query=SYLVIA Lake Grays Harbor County Washington
38,CANYON Creek Clark County Washington,"3,000","May 25, 2022",45.9578891,-122.3498187,https://www.google.com/maps/search/?api=1&query=CANYON Creek Clark County Washington
39,CANYON Creek Clark County Washington,"2,100","May 25, 2022",45.9578891,-122.3498187,https://www.google.com/maps/search/?api=1&query=CANYON Creek Clark County Washington
40,GISSBURG Pond NORTH Snohomish County Washington,994,"May 25, 2022",48.1432357,-122.1881846,https://www.google.com/maps/search/?api=1&query=GISSBURG Pond NORTH Snohomish County Washington
41,GISSBURG Pond SOUTH Snohomish County Washington,50,"May 25, 2022",48.1432357,-122.1881846,https://www.google.com/maps/search/?api=1&query=GISSBURG Pond SOUTH Snohomish County Washington
42,GISSBURG Pond SOUTH Snohomish County Washington,"2,360","May 25, 2022",48.1432357,-122.1881846,https://www.google.com/maps/search/?api=1&query=GISSBURG Pond SOUTH Snohomish County Washington
43,GOLF COURSE Pond Asotin County Washington,"1,950","May 25, 2022",46.4143753,-117.0876922,https://www.google.com/maps/search/?api=1&query=GOLF COURSE Pond Asotin County Washington
44,SYLVIA Lake Grays Harbor County Washington,500,"May 25, 2022",46.9977042,-123.5922925,https://www.google.com/maps/search/?api=1&query=SYLVIA Lake Grays Harbor County Washington
45,TARBOO Lake Jefferson County Washington,850,"May 25, 2022",47.923804,-122.852216,https://www.google.com/maps/search/?api=1&query=TARBOO Lake Jefferson County Washington
46,VANCE Creek ADLT Pond Grays Harbor County Washington,"1,000","May 25, 2022",47.00507560301562,-123.4233594994362,https://www.google.com/maps/search/?api=1&query=VANCE Creek ADLT Pond Grays Harbor County Washington
47,VANCE Creek JV Pond Grays Harbor County Washington,750,"May 25, 2022",47.00507560301562,-123.4233594994362,https://www.google.com/maps/search/?api=1&query=VANCE Creek JV Pond Grays Harbor County Washington
48,W EVANS Pond Asotin County Washington,"2,400","May 25, 2022",46.4188117,-117.1147994,https://www.google.com/maps/search/?api=1&query=W EVANS Pond Asotin County Washington
49,BENNINGTON Lake Walla Walla County Washington,"2,550","May 24, 2022",46.0651146,-118.260109,https://www.google.com/maps/search/?api=1&query=BENNINGTON Lake Walla Walla County Washington
50,FAILOR Lake Grays Harbor County Washington,"1,120","May 24, 2022",47.108716,-123.9584045,https://www.google.com/maps/search/?api=1&query=FAILOR Lake Grays Harbor County Washington
51,Lake LAWRENCE Thurston County Washington,"2,232","May 24, 2022",46.8538459,-122.5705849,https://www.google.com/maps/search/?api=1&query=Lake LAWRENCE Thurston County Washington
52,OFFUTT Lake Thurston County Washington,200,"May 24, 2022",46.9103763,-122.8256879,https://www.google.com/maps/search/?api=1&query=OFFUTT Lake Thurston County Washington
53,SWIFT POWER CANAL Skamania County Washington,"3,810","May 24, 2022",45.9428524,-121.8962257,https://www.google.com/maps/search/?api=1&query=SWIFT POWER CANAL Skamania County Washington
54,SWIFT RES Skamania County Washington,"36,090","May 24, 2022",45.9428524,-121.8962257,https://www.google.com/maps/search/?api=1&query=SWIFT RES Skamania County Washington
55,DUCK Lake Grays Harbor County Washington,640,"May 23, 2022",46.9731537,-124.1448812,https://www.google.com/maps/search/?api=1&query=DUCK Lake Grays Harbor County Washington
56,FAILOR Lake Grays Harbor County Washington,43,"May 23, 2022",47.108716,-123.9584045,https://www.google.com/maps/search/?api=1&query=FAILOR Lake Grays Harbor County Washington
57,JACKSON Lake Pierce County Washington,550,"May 23, 2022",47.28764289999999,-122.7743187,https://www.google.com/maps/search/?api=1&query=JACKSON Lake Pierce County Washington
58,LITTL WHITE SALMON RSkamania County Washington,"3,009","May 23, 2022",45.82462629759191,-121.6338189295824,https://www.google.com/maps/search/?api=1&query=LITTL WHITE SALMON RSkamania County Washington
59,Lake LAWRENCE Thurston County Washington,"2,286","May 23, 2022",46.8538459,-122.5705849,https://www.google.com/maps/search/?api=1&query=Lake LAWRENCE Thurston County Washington
60,GISSBURG Pond NORTH Snohomish County Washington,50,"May 20, 2022",48.1432357,-122.1881846,https://www.google.com/maps/search/?api=1&query=GISSBURG Pond NORTH Snohomish County Washington
61,GISSBURG Pond NORTH Snohomish County Washington,"1,000","May 20, 2022",48.1432357,-122.1881846,https://www.google.com/maps/search/?api=1&query=GISSBURG Pond NORTH Snohomish County Washington
62,HORSETHIEF Lake Klickitat County Washington,"2,000","May 20, 2022",45.6456938,-121.1026484,https://www.google.com/maps/search/?api=1&query=HORSETHIEF Lake Klickitat County Washington
63,REINERS Pond SNOHSnohomish County Washington,"1,500","May 20, 2022",48.0329979,-121.8339472,https://www.google.com/maps/search/?api=1&query=REINERS Pond SNOHSnohomish County Washington
64,REINERS Pond SNOHSnohomish County Washington,50,"May 20, 2022",48.0329979,-121.8339472,https://www.google.com/maps/search/?api=1&query=REINERS Pond SNOHSnohomish County Washington
65,SUMMIT Lake Thurston County Washington,"3,000","May 20, 2022",47.0541913,-123.103266,https://www.google.com/maps/search/?api=1&query=SUMMIT Lake Thurston County Washington
66,DEER Lake Columbia County Washington,500,"May 19, 2022",46.2775138,-117.814262,https://www.google.com/maps/search/?api=1&query=DEER Lake Columbia County Washington
67,MAYFIELD RES Lewis County Washington,"4,400","May 19, 2022",46.50871859999999,-122.569279,https://www.google.com/maps/search/?api=1&query=MAYFIELD RES Lewis County Washington
68,WATSON Lake Columbia County Washington,"1,000","May 19, 2022",46.2848889,-117.6549763,https://www.google.com/maps/search/?api=1&query=WATSON Lake Columbia County Washington
69,BATTLE GROUND Lake Clark County Washington,"3,013","May 18, 2022",45.8057593,-122.4935033,https://www.google.com/maps/search/?api=1&query=BATTLE GROUND Lake Clark County Washington
70,CASES Pond Pacific County Washington,425,"May 18, 2022",46.6766688,-123.7173851,https://www.google.com/maps/search/?api=1&query=CASES Pond Pacific County Washington
71,CRESCENT Lake TPierce County Washington,"1,500","May 18, 2022",47.3947982,-122.5674591,https://www.google.com/maps/search/?api=1&query=CRESCENT Lake TPierce County Washington
72,FLOWING Lake Snohomish County Washington,"2,665","May 18, 2022",47.9476839,-121.9872642,https://www.google.com/maps/search/?api=1&query=FLOWING Lake Snohomish County Washington
73,HICKS Lake Thurston County Washington,"2,095","May 18, 2022",47.01959490000001,-122.7978585,https://www.google.com/maps/search/?api=1&query=HICKS Lake Thurston County Washington
74,HOLMES DERBY Pond Island County Washington,50,"May 18, 2022",48.19765,-122.579457,https://www.google.com/maps/search/?api=1&query=HOLMES DERBY Pond Island County Washington
75,HOLMES DERBY Pond Island County Washington,600,"May 18, 2022",48.19765,-122.579457,https://www.google.com/maps/search/?api=1&query=HOLMES DERBY Pond Island County Washington
76,JEFFERSON Park Pond Walla Walla County Washington,83,"May 18, 2022",46.0556166,-118.3450028,https://www.google.com/maps/search/?api=1&query=JEFFERSON Park Pond Walla Walla County Washington
77,LONG Lake Thurston County Washington,"4,355","May 18, 2022",47.0211115,-122.776225,https://www.google.com/maps/search/?api=1&query=LONG Lake Thurston County Washington
78,MILL Pond Pacific County Washington,170,"May 18, 2022",46.5180824,-123.8264512,https://www.google.com/maps/search/?api=1&query=MILL Pond Pacific County Washington
79,OLD FISHING HOLE Pond King County Washington,"1,150","May 18, 2022",47.3769922,-122.2691246,https://www.google.com/maps/search/?api=1&query=OLD FISHING HOLE Pond King County Washington
80,PATTISON Lake Thurston County Washington,"4,450","May 18, 2022",46.99249820000001,-122.7723007,https://www.google.com/maps/search/?api=1&query=PATTISON Lake Thurston County Washington
81,BEEHIVE RES Chelan County Washington,"1,820","May 17, 2022",47.3228027,-120.3955096,https://www.google.com/maps/search/?api=1&query=BEEHIVE RES Chelan County Washington
82,BENNINGTON Lake Walla Walla County Washington,300,"May 17, 2022",46.0651146,-118.260109,https://www.google.com/maps/search/?api=1&query=BENNINGTON Lake Walla Walla County Washington
83,BLACK Lake Thurston County Washington,"1,500","May 17, 2022",46.9882439,-122.9793281,https://www.google.com/maps/search/?api=1&query=BLACK Lake Thurston County Washington
84,DEEP Lake Thurston County Washington,"2,500","May 17, 2022",46.9071679,-122.912977,https://www.google.com/maps/search/?api=1&query=DEEP Lake Thurston County Washington
85,HOOD PARK Pond Walla Walla County Washington,81,"May 17, 2022",46.2145152,-119.0131341,https://www.google.com/maps/search/?api=1&query=HOOD PARK Pond Walla Walla County Washington
86,LOST Lake Yakima County Washington,200,"May 17, 2022",46.6446015,-121.0699814,https://www.google.com/maps/search/?api=1&query=LOST Lake Yakima County Washington
87,LOST Lake Yakima County Washington,"1,680","May 17, 2022",46.6446015,-121.0699814,https://www.google.com/maps/search/?api=1&query=LOST Lake Yakima County Washington
88,MATTOON Lake Kittitas County Washington,"3,000","May 17, 2022",46.9781076,-120.5530429,https://www.google.com/maps/search/?api=1&query=MATTOON Lake Kittitas County Washington
89,RAPJOHN Lake Pierce County Washington,"2,000","May 17, 2022",46.9050638,-122.3425229,https://www.google.com/maps/search/?api=1&query=RAPJOHN Lake Pierce County Washington
90,SARGE HUBBARD Pond Yakima County Washington,840,"May 17, 2022",46.6015053,-120.4748382,https://www.google.com/maps/search/?api=1&query=SARGE HUBBARD Pond Yakima County Washington
91,SUMMIT Lake Thurston County Washington,"7,000","May 17, 2022",47.0541913,-123.103266,https://www.google.com/maps/search/?api=1&query=SUMMIT Lake Thurston County Washington
92,BALLINGER Lake Snohomish County Washington,"2,222","May 16, 2022",47.7820803,-122.3276873,https://www.google.com/maps/search/?api=1&query=BALLINGER Lake Snohomish County Washington
93,BENNINGTON Lake Walla Walla County Washington,"2,550","May 16, 2022",46.0651146,-118.260109,https://www.google.com/maps/search/?api=1&query=BENNINGTON Lake Walla Walla County Washington
94,CHAIN Lake Snohomish County Washington,"1,138","May 16, 2022",47.9036939,-121.9706406,https://www.google.com/maps/search/?api=1&query=CHAIN Lake Snohomish County Washington
95,FIO RITO LKN Kittitas County Washington,200,"May 16, 2022",47.17495479999999,-120.9319411,https://www.google.com/maps/search/?api=1&query=FIO RITO LKN Kittitas County Washington
96,FIO RITO LKN Kittitas County Washington,"3,000","May 16, 2022",47.17495479999999,-120.9319411,https://www.google.com/maps/search/?api=1&query=FIO RITO LKN Kittitas County Washington
97,JEFFERSON Park Pond Walla Walla County Washington,750,"May 16, 2022",46.0556166,-118.3450028,https://www.google.com/maps/search/?api=1&query=JEFFERSON Park Pond Walla Walla County Washington
98,Lake ALICE King County Washington,"1,100","May 16, 2022",47.532315,-121.8881221,https://www.google.com/maps/search/?api=1&query=Lake ALICE King County Washington
99,Lake GOODWIN Snohomish County Washington,"3,020","May 16, 2022",48.1389866,-122.2795902,https://www.google.com/maps/search/?api=1&query=Lake GOODWIN Snohomish County Washington
100,Lake ROESIGER Snohomish County Washington,"2,068","May 16, 2022",47.9834331,-121.9292931,https://www.google.com/maps/search/?api=1&query=Lake ROESIGER Snohomish County Washington
101,SPRING Lake Columbia County Washington,"3,100","May 16, 2022",46.2775138,-117.814262,https://www.google.com/maps/search/?api=1&query=SPRING Lake Columbia County Washington
102,TIMS Pond Yakima County Washington,"1,008","May 16, 2022",46.7318642,-120.7967565,https://www.google.com/maps/search/?api=1&query=TIMS Pond Yakima County Washington
103,AMERICAN Lake Pierce County Washington,"2,500","May 13, 2022",47.1335423,-122.5648657,https://www.google.com/maps/search/?api=1&query=AMERICAN Lake Pierce County Washington
104,BEEHIVE RES Chelan County Washington,"2,100","May 13, 2022",47.3228027,-120.3955096,https://www.google.com/maps/search/?api=1&query=BEEHIVE RES Chelan County Washington
105,BLUE Lake Columbia County Washington,"2,550","May 13, 2022",46.2775138,-117.814262,https://www.google.com/maps/search/?api=1&query=BLUE Lake Columbia County Washington
106,FISH Lake Chelan County Washington,"2,100","May 13, 2022",47.8346248,-120.7058599,https://www.google.com/maps/search/?api=1&query=FISH Lake Chelan County Washington
107,HORSESHOE Lake Cowlitz County Washington,83,"May 13, 2022",45.8941937,-122.7478859,https://www.google.com/maps/search/?api=1&query=HORSESHOE Lake Cowlitz County Washington
108,HORSESHOE Lake Cowlitz County Washington,18,"May 13, 2022",45.8941937,-122.7478859,https://www.google.com/maps/search/?api=1&query=HORSESHOE Lake Cowlitz County Washington
109,HORSESHOE Lake Cowlitz County Washington,"2,500","May 13, 2022",45.8941937,-122.7478859,https://www.google.com/maps/search/?api=1&query=HORSESHOE Lake Cowlitz County Washington
110,NOEL COLE Pond Lewis County Washington,300,"May 13, 2022",46.6195461,-122.4554639,https://www.google.com/maps/search/?api=1&query=NOEL COLE Pond Lewis County Washington
111,NOEL COLE Pond Lewis County Washington,50,"May 13, 2022",46.6195461,-122.4554639,https://www.google.com/maps/search/?api=1&query=NOEL COLE Pond Lewis County Washington
112,RAINBOW Lake Columbia County Washington,"2,550","May 13, 2022",46.2775138,-117.814262,https://www.google.com/maps/search/?api=1&query=RAINBOW Lake Columbia County Washington
113,SILVER Lake TSnohomish County Washington,50,"May 13, 2022",47.8924771,-122.185551,https://www.google.com/maps/search/?api=1&query=SILVER Lake TSnohomish County Washington
114,SILVER Lake TSnohomish County Washington,"1,500","May 13, 2022",47.8924771,-122.185551,https://www.google.com/maps/search/?api=1&query=SILVER Lake TSnohomish County Washington
115,W EVANS Pond Asotin County Washington,"2,550","May 13, 2022",46.4188117,-117.1147994,https://www.google.com/maps/search/?api=1&query=W EVANS Pond Asotin County Washington
116,WATSON Lake Columbia County Washington,"2,550","May 13, 2022",46.2848889,-117.6549763,https://www.google.com/maps/search/?api=1&query=WATSON Lake Columbia County Washington
117,AKL Pond King County Washington,300,"May 12, 2022",47.5480339,-121.9836029,https://www.google.com/maps/search/?api=1&query=AKL Pond King County Washington
118,CLEAR Lake Pierce County Washington,"4,000","May 12, 2022",46.9365949,-122.2987893,https://www.google.com/maps/search/?api=1&query=CLEAR Lake Pierce County Washington
119,FERRY Lake Ferry County Washington,"1,073","May 12, 2022",48.5217855,-118.8132615,https://www.google.com/maps/search/?api=1&query=FERRY Lake Ferry County Washington
120,FISH Lake Ferry County Washington,488,"May 12, 2022",48.4718375,-118.4974069,https://www.google.com/maps/search/?api=1&query=FISH Lake Ferry County Washington
121,LEWIS County Park PDS Lewis County Washington,"4,800","May 12, 2022",46.6195461,-122.4554639,https://www.google.com/maps/search/?api=1&query=LEWIS County Park PDS Lewis County Washington
122,PUTTERS Pond Douglas County Washington,"2,700","May 12, 2022",47.7790617,-119.7474606,https://www.google.com/maps/search/?api=1&query=PUTTERS Pond Douglas County Washington
123,PUTTERS Pond Douglas County Washington,"2,100","May 12, 2022",47.7790617,-119.7474606,https://www.google.com/maps/search/?api=1&query=PUTTERS Pond Douglas County Washington
124,BEEHIVE RES Chelan County Washington,"6,300","May 11, 2022",47.3228027,-120.3955096,https://www.google.com/maps/search/?api=1&query=BEEHIVE RES Chelan County Washington
125,FRANKS POND Chelan County Washington,500,"May 11, 2022",47.9445331,-120.6749068,https://www.google.com/maps/search/?api=1&query=FRANKS POND Chelan County Washington
126,FRANKS POND Chelan County Washington,30,"May 11, 2022",47.9445331,-120.6749068,https://www.google.com/maps/search/?api=1&query=FRANKS POND Chelan County Washington
127,HERITAGE Lake Stevens County Washington,"4,001","May 11, 2022",48.6356984,-117.5234626,https://www.google.com/maps/search/?api=1&query=HERITAGE Lake Stevens County Washington
128,HORSETHIEF Lake Klickitat County Washington,"2,000","May 11, 2022",45.6456938,-121.1026484,https://www.google.com/maps/search/?api=1&query=HORSETHIEF Lake Klickitat County Washington
129,Lake LEO Pend Oreille County Washington,"2,200","May 11, 2022",48.6489244,-117.4945304,https://www.google.com/maps/search/?api=1&query=Lake LEO Pend Oreille County Washington
130,Lake SAWYER King County Washington,25,"May 11, 2022",47.3339715,-122.0367083,https://www.google.com/maps/search/?api=1&query=Lake SAWYER King County Washington
131,Lake SAWYER King County Washington,"1,674","May 11, 2022",47.3339715,-122.0367083,https://www.google.com/maps/search/?api=1&query=Lake SAWYER King County Washington
132,LTL KLICKITATKlickitat County Washington,500,"May 11, 2022",45.81706680000001,-121.1525716,https://www.google.com/maps/search/?api=1&query=LTL KLICKITATKlickitat County Washington
133,SPEARFISH Lake Klickitat County Washington,"1,500","May 11, 2022",45.62801779999999,-121.1309036,https://www.google.com/maps/search/?api=1&query=SPEARFISH Lake Klickitat County Washington
134,BALLINGER Lake Snohomish County Washington,"3,801","May 10, 2022",47.7820803,-122.3276873,https://www.google.com/maps/search/?api=1&query=BALLINGER Lake Snohomish County Washington
135,BEEHIVE RES Chelan County Washington,30,"May 10, 2022",47.3228027,-120.3955096,https://www.google.com/maps/search/?api=1&query=BEEHIVE RES Chelan County Washington
136,BEEHIVE RES Chelan County Washington,"4,131","May 10, 2022",47.3228027,-120.3955096,https://www.google.com/maps/search/?api=1&query=BEEHIVE RES Chelan County Washington
137,BLACK Lake Thurston County Washington,"1,525","May 10, 2022",46.9882439,-122.9793281,https://www.google.com/maps/search/?api=1&query=BLACK Lake Thurston County Washington
138,BLACK Lake Thurston County Washington,"1,975","May 10, 2022",46.9882439,-122.9793281,https://www.google.com/maps/search/?api=1&query=BLACK Lake Thurston County Washington
139,FIRING CENTER Pond Yakima County Washington,348,"May 10, 2022",46.6757257,-120.4113526,https://www.google.com/maps/search/?api=1&query=FIRING CENTER Pond Yakima County Washington
140,FLOWING Lake Snohomish County Washington,"3,062","May 10, 2022",47.9476839,-121.9872642,https://www.google.com/maps/search/?api=1&query=FLOWING Lake Snohomish County Washington
141,HATCHERY Creek Grant County Washington,500,"May 10, 2022",47.1981147,-119.3732456,https://www.google.com/maps/search/?api=1&query=HATCHERY Creek Grant County Washington
142,HICKS Lake Thurston County Washington,"3,017","May 10, 2022",47.01959490000001,-122.7978585,https://www.google.com/maps/search/?api=1&query=HICKS Lake Thurston County Washington
143,Lake ABERDEEN Grays Harbor County Washington,228,"May 10, 2022",46.9834021,-123.7422743,https://www.google.com/maps/search/?api=1&query=Lake ABERDEEN Grays Harbor County Washington
144,Lake BOREN King County Washington,"1,995","May 10, 2022",47.5326663,-122.1651913,https://www.google.com/maps/search/?api=1&query=Lake BOREN King County Washington
