,Lake,Stocked Fish,Dates,latitude,longitude,Directions
145,MISSION Lake Kitsap County Washington,872,"May 10, 2022",47.5327865,-122.8263637,https://www.google.com/maps/search/?api=1&query=MISSION Lake Kitsap County Washington
146,NANEUM Pond Kittitas County Washington,"1,008","May 10, 2022",47.0040473,-120.4639663,https://www.google.com/maps/search/?api=1&query=NANEUM Pond Kittitas County Washington
147,NANEUM Pond Kittitas County Washington,100,"May 10, 2022",47.0040473,-120.4639663,https://www.google.com/maps/search/?api=1&query=NANEUM Pond Kittitas County Washington
148,WILDCAT Lake Kitsap County Washington,"1,757","May 10, 2022",47.60453769999999,-122.7668162,https://www.google.com/maps/search/?api=1&query=WILDCAT Lake Kitsap County Washington
149,BATTLE GROUND Lake Clark County Washington,"1,555","May 9, 2022",45.8057593,-122.4935033,https://www.google.com/maps/search/?api=1&query=BATTLE GROUND Lake Clark County Washington
150,BAY Lake Pierce County Washington,"4,000","May 9, 2022",47.244877,-122.7576496,https://www.google.com/maps/search/?api=1&query=BAY Lake Pierce County Washington
151,BEAR Lake Spokane County Washington,500,"May 9, 2022",47.925462,-117.3550015,https://www.google.com/maps/search/?api=1&query=BEAR Lake Spokane County Washington
152,BEEHIVE RES Chelan County Washington,"2,100","May 9, 2022",47.3228027,-120.3955096,https://www.google.com/maps/search/?api=1&query=BEEHIVE RES Chelan County Washington
153,BENNINGTON Lake Walla Walla County Washington,300,"May 9, 2022",46.0651146,-118.260109,https://www.google.com/maps/search/?api=1&query=BENNINGTON Lake Walla Walla County Washington
154,BLACK Lake Pacific County Washington,"2,000","May 9, 2022",46.3160225,-124.0422092,https://www.google.com/maps/search/?api=1&query=BLACK Lake Pacific County Washington
155,BUCK Lake Kitsap County Washington,326,"May 9, 2022",47.9108174,-122.5597365,https://www.google.com/maps/search/?api=1&query=BUCK Lake Kitsap County Washington
156,CLEAR Lake Thurston County Washington,"4,500","May 9, 2022",46.8223558,-122.4742636,https://www.google.com/maps/search/?api=1&query=CLEAR Lake Thurston County Washington
157,COOKS Lake Pend Oreille County Washington,147,"May 9, 2022",48.34325820000001,-117.1725898,https://www.google.com/maps/search/?api=1&query=COOKS Lake Pend Oreille County Washington
158,DAYTON JV Pond Columbia County Washington,25,"May 9, 2022",46.3237525,-117.9724367,https://www.google.com/maps/search/?api=1&query=DAYTON JV Pond Columbia County Washington
159,DAYTON JV Pond Columbia County Washington,250,"May 9, 2022",46.3237525,-117.9724367,https://www.google.com/maps/search/?api=1&query=DAYTON JV Pond Columbia County Washington
160,EASTON Pond Kittitas County Washington,"2,004","May 9, 2022",47.2349964,-121.1695993,https://www.google.com/maps/search/?api=1&query=EASTON Pond Kittitas County Washington
161,GISSBURG Pond Snohomish County Washington,"2,000","May 9, 2022",48.1432357,-122.1881846,https://www.google.com/maps/search/?api=1&query=GISSBURG Pond Snohomish County Washington
162,GRANDY Lake Skagit County Washington,"1,540","May 9, 2022",48.565539,-121.8001659,https://www.google.com/maps/search/?api=1&query=GRANDY Lake Skagit County Washington
163,KIWANAS Pond Kittitas County Washington,600,"May 9, 2022",47.17495479999999,-120.9319411,https://www.google.com/maps/search/?api=1&query=KIWANAS Pond Kittitas County Washington
164,KLINELINE Pond Clark County Washington,"2,000","May 9, 2022",45.7079342,-122.656096,https://www.google.com/maps/search/?api=1&query=KLINELINE Pond Clark County Washington
165,Lake ABERDEEN Grays Harbor County Washington,"1,250","May 9, 2022",46.9834021,-123.7422743,https://www.google.com/maps/search/?api=1&query=Lake ABERDEEN Grays Harbor County Washington
166,Lake KILLARNEY King County Washington,"2,510","May 9, 2022",47.2866017,-122.2909305,https://www.google.com/maps/search/?api=1&query=Lake KILLARNEY King County Washington
167,LONG Lake Thurston County Washington,"2,901","May 9, 2022",47.0211115,-122.776225,https://www.google.com/maps/search/?api=1&query=LONG Lake Thurston County Washington
168,LOOMIS Lake Pacific County Washington,"1,000","May 9, 2022",46.4338882,-124.0427692,https://www.google.com/maps/search/?api=1&query=LOOMIS Lake Pacific County Washington
169,MCINTOSH Lake Thurston County Washington,"4,415","May 9, 2022",46.8642531,-122.7727078,https://www.google.com/maps/search/?api=1&query=MCINTOSH Lake Thurston County Washington
170,RAINBOW Lake Columbia County Washington,25,"May 9, 2022",46.2775138,-117.814262,https://www.google.com/maps/search/?api=1&query=RAINBOW Lake Columbia County Washington
171,SNAG Lake Pacific County Washington,500,"May 9, 2022",46.4194831,-123.8147843,https://www.google.com/maps/search/?api=1&query=SNAG Lake Pacific County Washington
172,STAR Lake King County Washington,"3,318","May 9, 2022",47.3578777,-122.291511,https://www.google.com/maps/search/?api=1&query=STAR Lake King County Washington
173,WARD Lake Thurston County Washington,"2,641","May 9, 2022",47.0090097,-122.8750659,https://www.google.com/maps/search/?api=1&query=WARD Lake Thurston County Washington
174,WESTERN Lake Pacific County Washington,500,"May 9, 2022",46.4235019,-123.8203929,https://www.google.com/maps/search/?api=1&query=WESTERN Lake Pacific County Washington
175,GRAYS HRBR KIDS EVNT Grays Harbor County Washington,200,"May 7, 2022",46.93972649242301,-123.9940261888556,https://www.google.com/maps/search/?api=1&query=GRAYS HRBR KIDS EVNT Grays Harbor County Washington
